{"allowed_patterns":["tools/agent-enforcement/**"],"base_sha":"1111111111111111111111111111111111111111","changed_entries":[{"new_path":"tools/agent-enforcement/scope_guard.py","old_path":"tools/agent-enforcement/scope_guard.py","paths":[{"allowed_matches":["tools/agent-enforcement/**"],"forbidden_matches":[],"path":"tools/agent-enforcement/scope_guard.py","violations":[]}],"score":null,"status":"M"}],"contract_version":"v1","diagnostics":[],"execution_id":"golden-pass","forbidden_patterns":[".github/**"],"generation":{"canonical_json":"RFC8259-sort-keys-utf8-lf","timestamp_omitted":true},"head_sha":"2222222222222222222222222222222222222222","issue_body_sha256":"3333333333333333333333333333333333333333333333333333333333333333","issue_number":46,"schema":"styx.task-scope-report/v1","tool_version":"0.5.0","verdict":"PASS"}
