{"allowed_patterns":["new/**"],"base_sha":"1111111111111111111111111111111111111111","changed_entries":[{"new_path":"new/copied.mjs","old_path":"legacy/source.mjs","paths":[{"allowed_matches":["![styx-copy-source sha256=aaaaaaaaaaaaaaaaaaaaaaaaaaaaaaaaaaaaaaaaaaaaaaaaaaaaaaaaaaaaaaaa]"],"forbidden_matches":["legacy/**"],"path":"legacy/source.mjs","violations":[]},{"allowed_matches":["new/**"],"forbidden_matches":[],"path":"new/copied.mjs","violations":[]}],"score":68,"status":"C"}],"contract_version":"v1","diagnostics":[],"execution_id":"golden-copy-source-pass","forbidden_patterns":["legacy/**"],"generation":{"canonical_json":"RFC8259-sort-keys-utf8-lf","timestamp_omitted":true},"head_sha":"2222222222222222222222222222222222222222","issue_body_sha256":"3333333333333333333333333333333333333333333333333333333333333333","issue_number":177,"schema":"styx.task-scope-report/v1","tool_version":"0.5.0","verdict":"PASS"}
